instruction,context,response,category
Can I cancel or modify my order after I placed it?,Order related queries,"Once you have placed an order unfortunately you cannot change it.

You can cancel an order for a limited time after it's been placed. If this option shows as available to you, we recommend cancelling the order and placing a new one.

To cancel your order please click ‘cancel order' and confirm or go to ‘my orders' and cancel your order.

Please note:
You can request a cancellation only when the buttons ""cancel item"" or ""cancel order"" are active.

Cancelling an order cannot be undone, but you can always place a new order.

If you redeemed a voucher for your order, the order can only be cancelled in full.

Delivery and invoice addresses cannot be changed once you have placed an order, we advise that you cancel the order and place a new one using a different address.

Individual Zalando Partner items cannot be cancelled. You can only cancel the Partner order in full.",Orders
How do I place an order?,Order related queries,"Once you have decided on your selection place the desired item(s) in the shopping bag.

In your bag you will find all the items you have added. Before you click on ‘go to checkout' and proceed with payment to complete the order please check your choice of colour, size, and quantity

Please note:
After you confirm your order you cannot change any order details.

What happens after I place my order?
You will receive a confirmation email with your order number shortly after you order. You can check the status of your order under ‘my orders'

We will also notify you by email as soon as your delivery leaves our warehouse. This email will also provide you with your delivery tracking number.",Orders
Price changes ?,Order related queries,"Pricing on Zalando is based on independent internal calculation. Our product pricing is subject to change due to a variety of reasons including, but not limited to: availability, special offers, sales, and seasonal offers.

We always strive for the best possible prices. Make sure to check Zalando regularly so you don't miss out on any bargains!",Orders
What are limited items ?,Order related queries,"Limited items are particularly desirable items that are only available in small quantities.

Why can't I add this item to my bag?
We have a dedicated checkout for our most desirable or limited items, so the ‘Add to bag' button is replaced with ‘Buy now' to help you purchase your item more quickly!

Why can't I purchase this item?
We want to ensure that limited items (particularly desirable items that are only available in small quantities, for example) are available for our customers to order. For this reason, these items are protected by various technical security measures against being ordered, for example, by automated systems or commercially acting persons. Unfortunately, it cannot be ruled out that individual customers will not be able to complete the ordering process even though the security measures are not intended for them.",Orders
What if an item is out of stock?,Order related queries,"If an item you want is out of stock, you can register to be notified via email when it is available again.

Just click on 'Notify me' and confirm your email address.

If the item is available again within the next 3 months, we'll send you an automatic email to let you know.

Please note:
This email does not reserve the item, so if you're still interested then it's best to act quickly in case it sells out again.",Orders
How do invitations for hyped items work?,Order related queries,"How do I sign up for an invitation?
When you click on the item, you'll see a button that says ‘Sign up for an invite.' Make sure you select a colour and size before you sign up.

I got an invitation! Now what?
Congratulations! Now you can use the invitation to buy the item you wanted. Click ‘Shop now' in the email with your invite and go ahead and buy it. Remember, you can't change the colour or size of the item at this stage.

How long are invites valid for?
Invitations are typically valid for 2 hours from the time you have received them in your inbox. The validity of the invitation is clearly stated in the email with your invitation.

Why haven't I received an invitation yet?
Invites are typically limited as these items are in high demand. Once you've signed up for an invitation, you'll be in the running to get an invite for the next 7 days after the product's official release date. Invites are only sent out after the release date has been reached. If you don't get an invitation by then or the following next 7 days, we're sorry but you'll have to sign up for an invitation again when the item is back in stock.

How do I know if an item is invite-only?
You will know when an item is invite-only when you see the ‘Add to bag' button has been replaced with ‘Sign up for an invite.' Invite only items are typically in high demand and have limited stock availability.

Can I return invite-only items?
Yes, you can return invite-only items.

Can I change the size or colour after I've signed up for an invite?
Unfortunately, you cannot change the colour and size you picked after you have signed up for an invitation.

Can I sign up for multiple invitations?
Unfortunately, you can sign up for an invitation to buy an item only once. We will only consider your most recent sign-up. However, once 7 days have passed and you did not receive an invitation, you can sign up for another invitation if the product is still available.

What advantages do Plus members have to get invite only items?
We reserve dedicated stock of invite-only items for Plus members, so they're more likely to get an invite.",Orders
What can I do if I received an item I did not order?,Order related queries,"We are sorry that we have sent you an item that you did not order.

Please return the item to us and note on the return slip under reason 9 that you did not order this item.

If you still want the original item, just go ahead and place a new order. If you have already paid for the item, you will receive a refund within 14 days of the return being handed over to the carrier.",Orders
What are my payment options?,Order related queries,"We support the following payment methods:

- [Credit Card](https://www.zalando.co.uk/faq/how-do-i-pay-by-credit-card.html)

- [Paypal](https://www.zalando.co.uk/faq/how-do-i-pay-by-credit-card.html)

- [Gift Card](https://www.zalando.co.uk/faq/Vouchers)

Please note:
It might be possible that not all payment methods are available at the time of purchase. 
For more information: [Why is my preferred payment method not available?](https://www.zalando.co.uk/faq/why-is-my-preferred-payment-method-not-available.html)",Payments
How do I pay by Credit Card?,Order related queries,"You can pay by credit card using the following providers:

- MasterCard

- Visa

- Maestro

- Visa Electron

- Visa Debit

Please note:
You may see a pre-authorisation amount on your credit card, however your card will not be charged until your order is dispatched.

If you return an item you will be refunded to the original payment method.

If your order is cancelled you might still see the pre authorisation amount on your credit card statement. Depending on your bank, this may take up to 30 days to be released.

How secure are my payment transactions via Zalando?
We use certified SSL encryption for the secure transmission of your data. Your bank, PayPal, and credit card details are safe.",Payments
How do I pay by prepayment?,Order related queries,"After placing the order you will receive a confirmation email including the necessary details for the bank transfer.

Your ordered items will be reserved for you (for 7 days) until your payment is received.

We will start packing your order once we've received and processed your payment which may take up to 5 working days. For that reason the delivery time of your prepayment order may be a bit longer.

Please note:
Each order you make will need to be paid for separately.

If you return an item or if your order was cancelled, you will be refunded to the original bank account.",Payments
Why is my preferred payment method not available?,Order related queries,"We're sorry if your favourite payment method isn't available for your order.

With some payment methods, especially with invoice payments, we take the financial risk to provide you with a try before you buy service. This is why we risk check each transaction to ensure security for you and for us.

Some situations can influence the payment methods availability. For instance, if delivery address and billing address do not match because of typos, changes of address, family name or if you chose a Pick up Point for your delivery. Another reason might be if you still have some open invoices with us. Even If you've already transferred the money or made a return, it is possible that we haven't processed it yet.

However, please understand that we also consider that some payment methods may involve higher costs or risks. Like other platforms and shops, we use independent credit bureaus in order to have secure transactions and we reserve the right to decline a payment method for some orders (you can find more details in our Terms & Conditions).

Our Customer Care team has no way of changing the payment methods offered to you at checkout and we are unable to find out exactly why a payment method is not being offered.

If your favourite payment method is unavailable, we're sorry in advance. You will still be able to use all of our other services and can select one of the other options, which are all free.",Payments
How do I get a copy of my invoice?,Order related queries,"Below you can download invoices for your recent Zalando orders and some of the Partner orders. 
If you have just placed your order, please wait until the parcels have shipped for the invoices to become available. 
If your order hasn't been shipped yet, it will not appear on the list below.

[Log in to print an invoice copy for a recent order](https://accounts.zalando.com/authenticate?redirect_uri=https%3A%2F%2Fwww.zalando.co.uk%2Fsso%2Fcallback&client_id=fashion-store-web&response_type=code&scope=openid&request_id=eNZaXoqjSkGyI54X%3A450d08e0-701a-494a-b368-b208c59e077e%3AEtLbTTZf30vr+EB7&nonce=c5fdefe3-b0c4-45fa-a035-398b51d43405&state=eyJvcmlnaW5hbF9yZXF1ZXN0X3VyaSI6Imh0dHBzOi8vd3d3LnphbGFuZG8uY28udWsvZmFxL1BheW1lbnRzL2hvdy1kby1pLWdldC1hLWNvcHktb2YtbXktaW52b2ljZS5odG1sP2p1c3RfbG9nZ2VkX2luPTEiLCJ0cyI6IjIwMjQtMDktMTRUMDg6MDE6MjJaIn0%3D&premise=unified_sso_ui&ui_locales=en-GB&zalando_client_id=450d08e0-701a-494a-b368-b208c59e077e&cid=GA1.1.1737651450.1726050971&sales_channel=83c4e87f-6819-41bb-af61-46cddb8453f5&client_country=GB&client_category=fs&view=verify-email)

Your order isn't clickable?
Invoices for most Partner items and gift vouchers can't be downloaded here. 
In this case, you can contact our Customer Care team for a copy of the invoice. Please specify the order number in your request.",Payments
How to do online card payment with 3D Secure ?,Order related queries,"European regulations are changing to make online card payment more secure for you. For orders placed after January 1st 2021, you may be asked to authenticate your payment through a 3D secure process. This will be branded according to the type of card you're paying with, for example, Visa Secure, Mastercard Identity Check or American Express SafeKey.

What do I need to do?
If you haven't already, you will need to register your payment card for 3D Secure. Most banks usually provide a way to enrol your card online, so check the website of your bank for more information.If you have previously registered for 3D Secure, or have used this feature before, you will not need to register again. However, your bank may have defined an entirely new process to improve your payment experience. Some banks have designed a new smartphone application specifically for this purpose. Please get in touch with your bank for more information.To make sure you can pay for your next order easily and securely, we recommend that you activate 3D Secure before you place your next online order.

What will change?
You may have been asked to authenticate with 3D Secure when paying online before, however with the new regulation comes a new process, offering better security and easier ways to authenticate.The video below shows an example of how the new process could look. In this case, the bank uses the customer's smartphone and fingerprint to prove the customer's identity.",Payments
How secure are my payment transactions via Zalando?,Order related queries,We use certified SSL encryption for the secure transmission of your data. Your bank details are safe.,Payments
How do I pay by PayPal?,Order related queries,"If you choose to pay via PayPal, you will be redirected directly to PayPal at the end of the ordering process.

Please note:
If you return an item or if your order was cancelled, you will be refunded to your PayPal account. You can define in your PayPal account whether the amount should be forwarded to your bank account.

If your PayPal account is closed, we reserve the right to refund you to your bank account. It is not possible to choose a different PayPal account for the refund.",Payments
What happens to my gift card following a return?,Order related queries,"Paid for your order in full using a gift card?
In this case, it will be added back to your gift card total on your Zalando account. You can use it for your next order against eligible items. You can check your current available amount at any time under ""Gift cards"".

Have you paid for your order by combining a gift card with a different payment method?
The gift card is valid for fashion items. When you return one or more of these items, you will be refunded to the other payment method selected at checkout when you placed the order. For example, if you used a credit card as well as a gift card, you will be refunded to your credit card and the gift card will be applied to the kept fashion items.

If the gift card amount is larger than the amount used from the other payment method, you will be refunded to your gift card total.",Returns & Refunds
Why did I receive this email?,Order related queries,"In rare cases it happens that an item does not meet our quality standards. We then proactively reach out to you and ask you to send the item back to us.

We want to assure you that both we and the manufacturer of the branded products sold by us have high quality standards for our products, which is why they are regularly and thoroughly checked to an extent beyond the mere legal regulations.

We need to inform you that it was discovered that a product you have received does not comply with our Product Safety Standards. All particular reasons for this measure you will find in our email to you.

Please be aware that the return process for this recall differs from your standard returns. Please use the instructions provided to create a new label for returning the recalled item. Please also send the affected item back separately from any other items.

Returning the recalled items - step by step:
1. The documents needed to return the item(s) can be downloaded here.

Please insert

your name

your billing address

and the shipment number we have sent to you in our email

We can only correctly refund you if you provide us with this dedicated shipment number. The easiest way is to copy paste the number from this email.

Please do not use any other return label and do not return this recalled product together with other items.

2. Print the return label and stick the label on the package and bring your return to a local DHL office nearby.

Will I be refunded?
You will of course be fully refunded for the recalled item. If there is no other information in our email, this will happen as soon as we have received your return.

In order to refund you the amount you paid for your article(s), we kindly ask you to provide us with your bank details if:

you placed your order more than two years ago using PayPal

you paid for your order using a credit card that is no longer valid

your bank details have changed

(Please note: There is no need to inform us before you have sent it back.)

In any other case, we will refund you back to the payment method you used for your order.",Returns & Refunds
How can I return my order?,Order related queries,"You can return your unused items within 100 days free of charge.

Can I return items from different orders together?
Yes, if you have several orders shipped by Zalando you can send them back to us in one parcel. If you want to return Zalando and Partner items please put them into separate parcels. Partner items are marked with “Sold by a Partner” in the order overview in your customer account.

When will I receive my refund?
You will receive your refund within 14 days after you handed over the return parcel to the carrier. Please make sure to keep the return receipt from the carrier until you have received your refund.

Which carrier can I use to return my parcel?
You can find this information on the return label. If you are using a return code you can return your parcel via Evri.

How does home collection work?
You can book a Home Collection on the Evri website.

How long is the return code valid?
Your return code is valid for 90 days. If you haven't had a chance to drop off your parcel during this time, you can find a valid code in the 'Returns' section of your account.

Related questions:
- [How do I return items using a QR code?](https://www.zalando.co.uk/faq/how-do-i-return-items-using-a-qr-code.html)

- [How do I return items with a return label?](https://www.zalando.co.uk/faq/how-do-i-return-items-with-a-return-label.html)

- [How do I find the QR code or the return label I generated?](https://www.zalando.co.uk/faq/how-do-i-find-the-qr-code-or-the-return-label-i-generated.html)",Returns & Refunds
How do I return items with a return label?,Order related queries,"You can find the return label attached to the delivery slip. Attach the return label on the return parcel and drop off the parcel at the carrier.

If you do not have a return label, you can create one under “Returns” in your account. If this option is not available, please contact our customer service and we will provide you with one.",Returns & Refunds
How will I receive my refund?,Order related queries,"We will refund you via the payment method you selected during the order process.

What if I paid via a gift card?
When you return goods purchased with a gift card, the refund will be added to your account and you can use it on future orders. Gift card total cannot be exchanged for cash.

Please note:
Refunds for Zalando and Partner orders are made separately. Therefore you will receive your refund separately and at different times.

We do not reimburse the express delivery fee if you return the order",Returns & Refunds
When will I receive my refund?,Order related queries,You will receive your refund within 14 days from the day you handed over the return parcel to the carrier. You will receive your refund via the payment method you selected during the order process.,Returns & Refunds
What can I do if I do not have a return label?,Order related queries,"If you have already created a return online, you can create a return label under 'Returns' in your account.
If you have not yet created a return, click the 'Return items' button to create a return. 
Once you have completed this process, you can create a return label or QR code.",Returns & Refunds
What if my item is damaged or defective?,Order related queries,"We are sorry that your item has arrived damaged or defective.

Click on the ""Submit a claim here"" button below and provide us with all relevant information so that we can resolve your issue as soon as possible.

Important note: Only use this button to report a damaged or defective item.

[Submit a claim here](https://www.zalando.co.uk/contact?show_reclamation=true&self_help_article_id=c8046e64-8820-4b59-9fa4-3f09bc5a44af&self_help_article_name=What%20if%20my%20item%20is%20damaged%20or%20defective?&self_help_article_category=undefined)

Do I automatically receive a replacement?
No, unfortunately it's not possible for us to send you a replacement. If you would still like the item, please just place a new order. You will find a link directly to the product in the ""Orders"" section of your account. If the item is sold out - click ""Notify me"" on the product page and we'll let you know when it's available again.",Returns & Refunds
What is your return policy?,Order related queries,"You can return unused items within 100 days free of charge.

All returned items must be in their original condition (unworn and with the labels still attached) for a return to be accepted. Trying on an item doesn't count as it being worn.

Related questions:
[How can I return my order?](https://www.zalando.co.uk/faq/how-can-i-return-my-order.html)",Returns & Refunds
Can I return items from different orders together?,Order related queries,"Yes, you can. If you have several orders shipped by Zalando you can send them back to us in one parcel.

Can I return Zalando and Partner items together?
Unfortunately this is not possible. Partner items need to be returned directly to the partner. Please return Zalando and Partner items in separate parcels. Partner items are marked with “Sold by a Partner” in the order overview in your customer account.

Related questions:
- [How can I return my order?](https://www.zalando.co.uk/faq/how-can-i-return-my-order.html)
- [What can I do if I do not have a return label?](https://www.zalando.co.uk/faq/how-can-i-return-my-order.html)",Returns & Refunds
Can I exchange an item?,Order related queries,"Unfortunately, we don't offer exchanges, only refunds.

With our free return policy you have 100 days from the date of delivery to return your unused items.

You can return your original order for a full refund and place a new order.

Related questions:
- [How can I return my order?](https://www.zalando.co.uk/faq/how-can-i-return-my-order.html)",Returns & Refunds
What can I do if I received an item I did not order?,Order related queries,"We are sorry that we have sent you an item that you did not order.

Please return the item to us and note on the return slip under reason 9 that you did not order this item.

If you still want the original item, just go ahead and place a new order. If you have already paid for the item, you will receive a refund within 14 days of the return being handed over to the carrier.",Returns & Refunds
How can I return a Zalando Partner item?,Order related queries,"Please return Partner items in a separate parcel then Zalando items.

You can return unused Partner items within 100 days free of charge.

[Return items](https://accounts.zalando.com/authenticate?redirect_uri=https%3A%2F%2Fwww.zalando.co.uk%2Fsso%2Fcallback&client_id=fashion-store-web&response_type=code&scope=openid&request_id=wmTVBrkiwqWxM2Y5%3A450d08e0-701a-494a-b368-b208c59e077e%3AwmTVBrkiwqWxM2Y5&nonce=0fa4e0bb-44ec-476c-8794-fe314668bc4c&state=eyJvcmlnaW5hbF9yZXF1ZXN0X3VyaSI6Ii9yZXR1cm5zL2FydGljbGVzLyIsInRzIjoiMjAyNC0wOS0xNFQwODozNTozN1oifQ%3D%3D&premise=unified_sso_ui&ui_locales=en-GB&zalando_client_id=450d08e0-701a-494a-b368-b208c59e077e&cid=GA1.1.1737651450.1726050971&sales_channel=83c4e87f-6819-41bb-af61-46cddb8453f5&client_country=GB&client_category=fs&view=verify-email)

What if I do not have a return label?
If you do not have a return label, you can create one in your account. If this option is not available, please contact our customer service and we will provide you with one.

When will I receive my refund?
You will receive your refund within 14 days after you handed over the return parcel to the carrier. Please make sure to keep the return receipt from the carrier until you have received your refund.",Returns & Refunds
How can I return items sold and shipped by a store?,Order related queries,"You can return unused items that are sold and shipped by a store within 100 days free of charge.

Please return items sold and shipped by a store in a separate parcel then Zalando items.

What if I do not have a return label?
If you do not have a return label please reach out to our customer service.

When will I receive my refund?
You will receive your refund within 14 days after you handed over the return parcel to the carrier. Please make sure to keep the return receipt from the carrier until you have received your refund.",Returns & Refunds
What happens to my gift card following a return?,Order related queries,"This will depend on how you used your gift card:

Did you pay for your order in full using a gift card?
In this case, it will be added back to your gift card total on your Zalando account. You can use it for your next order against eligible items. You can check your current available amount at any time under ""Gift cards"".

Did you pay for your order by combining a gift card with a different payment method?
The gift card is valid for fashion items. When you return one or more of these items, you will be refunded to the other payment method selected at checkout when you placed the order. For example, if you used a credit card as well as a gift card, you will be refunded to your credit card and the gift card will be applied to the kept fashion items.

Did you pay for your order via invoice and gift card ?
If you used your gift card for valid fashion items against part of your order, and selected invoice payment for the remaining amount, and you return an item, the open amount on the invoice will be reduced

If the gift card amount is larger than the open amount on your invoice, you will be refunded to your gift card total.",Returns & Refunds
