instruction,context,response,category
Report content on Zalando,Non order related queries,"What is reporting?
Reporting allows you to flag content related to any items and reviews on the Zalando app or website, based on concerns that it might not be in line with applicable laws or our policies.

While we have rigorous checks in place to make sure everything on Zalando is compliant, if you’re concerned about something you found, let us know and we’ll have a look.

What can I report and how?
You can report any item on Zalando, or anything about its details or how it’s shown. You can also report all reviews on Zalando. Look out for the ‘Report’ link marked with a flag icon present on every item details page or for the ‘Report’ button next to the review.

This reporting mechanism is not for content outside of the Zalando website or app — like emails, social media posts, ads or anything else.

What are the reasons for reporting?
You can report items or their related content, or reviews, on legal grounds — if you think they might violate any applicable laws or Zalando policies.

To make it easier to know what counts as legal grounds when reporting items, we’ve created the following categories:

	* Intellectual property and copyrights
	* Wrong or missing information
	* Product safety concerns
	* Environmental concerns
	* Inappropriate content

If you have a legal ground for reporting that’s not covered here, you can tell us about it by entering additional information in the reporting form.

Similarly, we’ve created the following categories when reporting reviews:

	* Intellectual property and copyrights
	* Inappropriate content

Can I report things for other reasons?
Reporting is a way for you to share your concerns about items or their related content or about reviews based on legal grounds. For any other reasons, like issues with your orders and deliveries, please contact our [customer care team](https://www.zalando.co.uk/faq/).

What happens after I report something?
The item or its content, or the review that you report, along with your concerns, will be sent to the relevant team for review. They’ll assess it against applicable laws and Zalando policies to make sure that it’s compliant. If not, they’ll decide what actions to take, like removing the item or its content, or removing the review from Zalando.

Through the process, we’ll share email updates on our decisions and actions, so keep an eye on your inbox.

What if I don’t agree with your decision?
In the email that you get about our decision, you’ll also find a link to contest the decision if you disagree with it. You can do this any time within 6 months of receiving it. In that process, you’ll also be able to give us any additional information that could help us rethink our decision.

Of course, you’ll also have the option to approach any out-of-court settlement body to challenge our decision, or appeal against it in the relevant courts.

What are trusted flaggers?
Trusted flaggers are individuals or organisations who have been recognised as such by the relevant authorities, as defined in Article 22 of the EU Digital Services Act. If you are a trusted flagger, please make sure that the email address you enter in the reporting form is the same as the one you registered with the authorities. We’ll then make sure to process it according to the applicable guidelines.",Ratings and Reviews
What are Ratings and Reviews?,Non order related queries,"You can now read customer reviews on Zalando!

We know shopping online can be challenging, so we want to make this experience as easy as possible for you.

If you want to learn more about submitting reviews and read our Review Guidelines, see our [Terms of Use](https://www.zalando.co.uk/faq/ratings-and-reviews/terms-of-use-for-ratings-and-reviews).",Ratings and Reviews
Where can I see the ratings and reviews?,Non order related queries,"You can see customers’ ratings and reviews directly on the product page!

Our site will feature reviews from other retailers for the same product, which you'll be able to easily identify as third-party reviews in proximity to the review, helping you make an even more informed decision when considering a purchase.

How are overall ratings calculated?
Overall ratings are calculated based on the average of all ratings submitted for a product. This helps give a balanced view of the product’s performance according to all customer feedback.",Ratings and Reviews
How are reviews being moderated?,Non order related queries,"All ratings and reviews are systematically checked by our moderation partner before being uploaded to our website.

Once a review is published on our website, other Zalando customers can report inappropriate content. 
All reports will be validated against our Review Guidelines and actions may be taken. 
For more information on reporting inappropriate content, please see [Report content on Zalando](https://www.zalando.co.uk/faq/ratings-and-reviews/report-content-on-zalando).

How do I report an inappropriate review?
If you come across a review that you believe is inappropriate, you can report it by clicking the ""Report"" button next to the review. Our team will then review the report and take action accordingly.",Ratings and Reviews
What are our Review Guidelines?,Non order related queries,Our Review Guidelines set our standards for reviews that can be displayed on the platform. You can find them in our [Terms of Use](https://www.zalando.co.uk/faq/ratings-and-reviews/terms-of-use-for-ratings-and-reviews).,Ratings and Reviews
Terms of Use for Ratings & Reviews,Non order related queries,"Summary of our Terms of Use for Ratings & Reviews

These Terms of Use for Ratings & Reviews give you an overview of the rules of leaving ratings and submitting reviews and your obligations and rights associated with it.

When and how can I rate or review a product?

We might offer you the option to leave ratings and reviews if you have a customer account and have purchased products eligible for ratings and reviews.

Moderation of reviews :

Every submitted review is subject to moderation. Your review will be published only after it was accepted as in line with our Review Guidelines. If it is not in line with our Review Guidelines and cannot be published, we will inform you about it. Submission of a review does not constitute a claim for publication.

Review Guidelines :

The review shall contain information about the product being reviewed and/or your experience with this product, which can be positive or negative. There are 7 main categories of content which, if found in the review or any additional information provided, will make the review ineligible for publishing or subject to deletion.

Rights of use and liability :

By submitting a review and any optional additional information, you grant us rights to use your review. You are solely liable for the legally impeccable content of your review.

Reporting reviews :

Your review may be reported by other users in case they consider your review to be illegal content. If we find it to be illegal or not in line with our Review Guidelines, we will delete it. If you want to find out more about reporting content, have a look at our FAQ section Report content on Zalando .

Misuse :

If you frequently submit reviews that contain illegal content or are not in line with our Review Guidelines, we can suspend the submission of reviews for you due to misuse. Before suspending, we will issue a warning.

Customer care :

You can contact our customer care team if you have any questions.

Further information :

Your contractual partner is Zalando SE.

1. When and how can I rate or review a product?

1.1. If you have a customer account and you have purchased a product that is eligible for ratings and reviews on the respective local Zalando website, its mobile version or the respective local version of the Zalando app (“ Channels ”), you may have the possibility to leave a rating and review. You can only leave a rating and/or review for a product once. Products from cancelled orders cannot be rated or reviewed. You can only submit a review if you also leave a rating of the product. You must be at least 18 years old.

1.2. Once you submit a rating and/or review, you cannot change it anymore. To request the deletion of your review that was published, please contact our customer care team . If you decide to delete your account, your review will be anonymised instead of being deleted. This means your review will remain published, but it will no longer be associated with your account.

1.3. When leaving a rating and/or a review, you may be asked to provide additional information such as a review title, name, a nickname or fictitious name, and further attributes in order to make your review more useful for other users.

1.4. We do not offer any compensation for leaving ratings or submitting reviews, be it monetary or otherwise e.g. in the form of discounts or any other benefits on our platform.

2. Moderation of reviews

2.1. Any review submitted will be moderated according to our Review Guidelines by our third-party moderator (“ Bazaarvoice ”) and has to be accepted before publishing. In order for your review to be accepted for publication, it needs to comply with our Review Guidelines described below. We usually publish the review within 72 hours. We do not alter reviews. If your review is not in line with our Review Guidelines and therefore cannot be published, we will inform you about it by email. Submission of a review does not constitute a claim for publication.

2.2. By submitting a review, you agree to adhere to our Review Guidelines. You also declare that you are the author of the review and that you have not received compensation, be it monetary or otherwise, for the submission of the review.

2.3. If, after publication of your review, we find that your review is not compliant with applicable laws or our Review Guidelines, we may delete your review.

2.4. For the moderation of your review before publishing, Bazaarvoice uses both technical as well as human validation processing steps.

3. Review Guidelines

3.1. The review shall contain information about the product being reviewed and/or your experience with this product, which can be positive or negative. There are 7 main categories of content which, if found in the review or any additional information provided, will make the review ineligible for publishing or subject to deletion. The review may not contain the following:

3.1.1. personal details , such as: first and/or last name, address, phone number, email address, date of birth, any other unique identifiers like a social security number, credit card number, bank account details, customer number, order number;

3.1.2. mention of the price of the product, unless relevant to the product's value;

3.1.3. comparison between Zalando and its competitors and partners or other brands, shops or retailers, regardless of whether the comparison is positive or negative;

3.1.4. incorrect language , i.e. reviews written in a different language to the language of the Channel;

3.1.5. illegible content , such as reviews that are not clear enough to understand;

3.1.6. irrelevant information , i.e. reviews that are not describing the product or the experience with the product, and instead solely describe shipping, delivery, payment, user account, discounts, order process etc.;

3.1.7. offensive and/or illegal content such as:

a. discriminatory or hateful language , including derogatory statements based on ethnic or national origin, gender, religion, political views, disability, age or sexuality; support for racism, sexism or other discriminatory ideas; shaming of body shape or size (body shaming); hate-based conspiracy theories and misinformation; denial of an individual’s gender identity or sexual orientation; attacks on individuals, including public figures based on their membership in a vulnerable or protected group; mocking or attacking the beliefs, sacred symbols, movements, or institutions of the protected or vulnerable groups;

b. messages of self-injury and harmful behaviour , including comments containing instructions, promotion or reference to self-harm;

c. political extremism , including fascist and far-right related comments and symbols associated with political extremism;

d. adult content , including descriptive or graphic depictions of sexual activity;

e. glorification of violence and use of weapons , including descriptions and depictions of or references to violence and weaponry; explicitly referring, showing or hinting at extremist or terrorist organisations; linking to gangs;

f. defamation of religion , including negative or mocking comments of any registered religion;

g. perpetuation of stereotypes and cultural appropriation , including slurs or caricatures based on stereotypes; implying negative assumptions about people from certain groups; depictions of cultural symbols, iconography, traditions (including the use of language) which are not representative of the user’s own heritage;

h. objectification and exploitation , including sexualization or exploitation of minors (under 18 year olds); sexualization of individuals; descriptions or images that depict lack of consent of an individual, hint at any form of trafficking, sexual or physical exploitation, child labour and forced labour;

i. allude or mention to substance use , including any reference to drugs, including but not limited to hard drugs (e.g. cocaine, heroin, magic mushrooms); content promoting or celebrating the use of alcohol, cigarettes and drugs;

j. inappropriate language , including targeted language that is offensive to women and minorities, and words such as “fuck” as well as other swear words, also implied;

k. intellectual property rights infringements ;

l. content which goes against animal welfare and sustainability principles , such as those expressed in Zalando’s Animal Welfare Policy and Zalando’s Sustainable Sourcing Policy, such as expressing support of animal abuse.

3.2. This list is not exhaustive and refers to text content as well as graphic content, such as images or emojis.

4. Rights of use and liability

4.1. By submitting a review and/or the additional information, you confirm that you are the author of the content of the review and/or have all necessary licences, rights, consents, and permissions to submit the review and hold all rights to the content of the review and its elements, and grant us a non-exclusive, royalty-free, perpetual, worldwide, transferable, free of charge licence to use, reproduce, modify, adapt, publish, translate, distribute, and display your review and the additional information you decided to provide in any form, medium or technology. This licence includes, but is not limited to, the right to display your review, translate your review into other languages, including but not limited to marketing, advertising, promotional and informative purposes and materials, incorporate your review into insights, reports, summaries, articles, or aggregated feedback, including making use of your title, name, nickname or fictitious name. Zalando shall have the right, but not the obligation, to include the title, name, nickname or fictitious name with the review.

4.2. The licence is sublicensable to our third-party moderator Bazaarvoice who we cooperate with for the provision of these ratings and review services.

4.3. You are solely responsible for the content of your review. You are obligated to indemnify and hold harmless Zalando (and its officers, directors, agents, representatives, employees and third-party providers) from all claims and damages and consequential damages of any kind and nature, known or unknown, including attorneys' fees, resulting from non-compliance with the Terms of Use, a violation of the law, and a violation of the rights of third parties.

5. Reporting reviews

5.1. Your review may be reported by other users in case they consider your review to be illegal content. In this case we will check the validity of the concern raised and will assess the review against applicable laws and our Review Guidelines to make sure that it is compliant.

5.2. If we find that your review is not compliant with applicable laws or our Review Guidelines, we will delete your review which we will inform you about. You can contest our decision if you don’t agree with it within 6 months of being informed of the decision. You will also have the option to approach any out-of-court settlement body to challenge our decision, or appeal against it in the relevant courts. If you want to find out more about reporting content, you will find answers in our FAQ section Report content on Zalando . There, you will also find information on contesting decisions restricting visibility of your review.

6. Misuse

6.1. In the event of any instance of misuse, we shall temporarily (or permanently) suspend the submission of reviews. The term “misuse” shall apply if you frequently submit reviews that violate applicable laws or our Review Guidelines. We shall consider all facts and circumstances available to us when assessing instances of abuse, and when deciding as to whether, and if so, for how long, to suspend the submission of reviews. This shall comprise the absolute number of reviews containing manifestly illegal content, the relative proportion of reviews containing illegal content in total, the severity of the instance of misuse, including the type of illegal content, and of its consequences, and – if ascertainable – the intentions being pursued by the person submitting reviews.

6.2. Before suspending the submission of reviews, we shall issue a warning. We shall also inform you about the duration of any possible suspension.

7. Customer care

7.1. For questions please contact our customer care team .

8. Further information

8.1. Your contractual partner is Zalando SE (“ Zalando ”):

Zalando SE

Valeska-Gert-Str. 5, 10243 Berlin

Executive Board: Robert Gentz & David Schneider (both co-chairs of the board), Dr. Astrid Arndt, Dr. Sandra Dembeck, David Schröder

Supervisory Board Chairperson: Kelly Bennett

Registered with the Local Court (Amtsgericht) of Charlottenburg Berlin, HRB 158855 B VAT ID: DE 260543043

WEEE-Reg.-Nr. DE /WEEG-Reg.-No GER: 72754189",Ratings and Reviews
How do I find the right size or fit?,Non order related queries,"As sizes and measurements can vary across, as well as within brands, it can sometimes be difficult to find the right size and fit for you. To help you with your search, Zalando offers the following tools and information:

Shop by Range
We offer a wide variety of sizes and fits which are specific to your needs. By using the filter “Specialty sizes” in the shop you can choose between Plus Size, Petite, Tall, Maternity, and Standard items.

Size recommendation
For some items, you might see suggestions based on your recent purchases and returns, and items you’ve told us fit you well. We also take into account feedback from other customers, and each brand’s particular sizing.

Size & fit
For most items you can view more information on the product page under ‘the Size & fit’ dropdown menu. Here you’ll be able to see what size the model is wearing and the measurements for this size. You can also find a link to the general size guide.

If a brand is using different sizes, you can access the size conversions in the size selector.",Sizing
How do I reset my password?,Non order related queries,"Reset your password. Enter the email address you use for your Zalando account and click send. You'll receive an email with a link to reset your password. Click on the link in the email and you will be prompted to enter a new password.

You can then use your new password to login to your Zalando account.

Please note:
This email may take a couple of hours to reach you and could appear in your spam or junk folder.",My Account
How does Zalando protect my account?,Non order related queries,"We know that security and protection are important to our customers, therefore we continuously improve our security measures. Our website is equipped with protection mechanisms like two factor authorisation to ensure that any data you provide is secure and cannot be accessed by unauthorised parties. We monitor account activity for suspicious behaviour and will alert you if we detect anything out of the ordinary.

You may be asked from time to time to verify your account with a code or logging in again.

What should I do if I see unauthorised activity in my account?
If you believe that your account was misused, please contact our customer care team using one of the contact buttons below so that we can deactivate the account and prevent further misuse. Our specialists will advise you on any further steps.",My Account
How do I update my account information?,Non order related queries,"You can update your account information by following the steps below:

* Delivery address: You can change your delivery and billing address under ‘Addresses' in your account .

* Credit card: you can update your preferred Credit Card during the checkout process.

* Personal data (email address, password, contact data): you can change your personal data such as your email address, password or contact data under ‘Personal details' in my account.

* Fashion Preferences / items you like: You can change your Fashion Preference and items you like under ‘Recommendation preferences' in your account.",My Account
How do I delete my user account?,Non order related queries,"You can delete your user account under ‘Request or delete data' in your account.

Please note that we can only delete your account if:
	* There are no open amounts due

	* You do not have an order that is still within the return period

	* You do not have remaining gift card balance on your account

	* None of your orders are currently in shipment

Will my Lounge by Zalando account also be deleted?
When you delete your Zalando account, your Lounge by Zalando will also be deleted.

Can I use my Zalando account in another country?
Yes, you can use your Zalando account in another country. Just use your existing login details to access a different country's Zalando shop, and add a new billing/shipping address located in the country you're shopping from.",My Account
What should I know about the newsletter?,Non order related queries,"When you subscribe to our newsletter you will get updates on all the latest trends and fashion twice a week. Every Tuesday you will receive a newsletter supplement featuring a special topic on style. You will also be the first to know about new products, discounts, and promotions to take advantage of our latest offers and services.

How can I subscribe to the newsletter?
You can subscribe to our newsletter under ‘Newsletters' in your account.

How can I unsubscribe from the newsletter?
You can unsubscribe from our newsletter under ‘Newsletters' in your account.

Please note:
Before you unsubscribe, please make sure that you do not mark these emails as spam, as this may also block the delivery of other important emails from Zalando (order confirmation, etc).",My Account
How do I create a Zalando account?,Non order related queries,"To create a Zalando account simply follow these steps and you'll soon be ready to order.

1. Click the login icon which can be found on the top right-hand corner of your screen.

2. Enter your email address under 'I'm new here' and click on 'Register'. Then complete all mandatory fields.

3. Once you've completed the registration, you will receive a confirmation email. We suggest that you check the information in this email carefully, to make sure that it is correct.

To confirm your registration, click on the link provided in the email. Once your registration has been confirmed, you can login and start shopping.",My Account
What should I know about phishing emails?,Non order related queries,"Unfortunately, email scams are a serious issue that sometimes affects us too. Known as ‘phishing attacks', in these emails fraudsters impersonate trusted entities, often using elements like a company logo and a familiar layout to deceive users into sharing sensitive information or taking harmful actions. These may for example take the form of fake order confirmation and payment reminder emails.

Please never visit any links or open any attached files in any emails that look suspicious.

Things to look out for:
Spelling errors or grammar inconsistencies: these emails are typically auto-generated or poorly translated.

The sender's address. It should match the domain of the company or entity they claim to represent.

How they address you: For instance, at Zalando, we always use your name (e.g ‘Hello Juan'). If it simply says ""Dear user/client,"" be suspicious!

In addition, before clicking on any links to share any information, you can log in into the official app or website of the company or service they claim to be from and check for notifications there first.

Do you suspect scammers may have got a hold of your personal details?
We recommend that you change your password as soon as possible. To do this, go to 'Change contact data'. Please also check your access details to other important accounts (e.g. online banking) and change these if necessary.

If you have any other questions about email phishing, get in contact with us and we will be glad to help out.",My Account
