instruction,context,response,category
Why did I receive an email about an item recall?,Order related queries,"We would like to inform you that we have to recall an item that you purchased on Zalando.

It is our top priority to make sure that you only receive high quality goods when you shop on Zalando and we are very sorry for the inconvenience caused. Should an item not meet our quality standards for any reason, we will proactively send an email in which we inform our customers about this.

Depending on the item or quality defect, we might ask you to return the item to us. We will also let you know should a return exceptionally not be required.

What should I do if I am asked to return the item?
Our email to you will contain all relevant information. Please make sure to read the instructions in the email carefully, as the return and refund process for recalled items is different from the usual return process at Zalando.

If we ask you to return the item, our email will have a link to create a return label which is different from the return label that you received with your order. Please use the new label for returning the recalled item and send it back to us. Please also send the affected item back separately from any other items.

Will I be refunded for the recalled item?
You will of course be fully refunded for the recalled item. If there is no other information in our email, this will happen as soon as we have received your return.

Depending on the payment method or how long ago you purchased the item, we might ask you to reach out to our customer care via our usual contact channels.",Returns & Refunds
How do I find the QR code or the return label I generated?,Order related queries,You can find the QR code and the return label under “Your Returns” in your account.,Returns & Refunds
How do I return a Zalando Partner item?,Order related queries,"You can return your Partner items within 100 days, free of charge.

[Return items](https://accounts.zalando.com/authenticate?redirect_uri=https%3A%2F%2Fwww.zalando.co.uk%2Fsso%2Fcallback&client_id=fashion-store-web&response_type=code&scope=openid&request_id=m0k6JhA5a5t9394y%3A450d08e0-701a-494a-b368-b208c59e077e%3Am0k6JhA5a5t9394y&nonce=f1025565-9424-4f39-b23d-15334502c91f&state=eyJvcmlnaW5hbF9yZXF1ZXN0X3VyaSI6Ii9yZXR1cm5zL2FydGljbGVzLyIsInRzIjoiMjAyNC0wOS0xNFQwODo0MDoxM1oifQ%3D%3D&premise=unified_sso_ui&ui_locales=en-GB&zalando_client_id=450d08e0-701a-494a-b368-b208c59e077e&cid=GA1.1.1737651450.1726050971&sales_channel=83c4e87f-6819-41bb-af61-46cddb8453f5&client_country=GB&client_category=fs&view=verify-email)
How do I return an item that was sent to me directly by a Zalando Partner?
Please send the item back to the Partner. Just use the enclosed return label to send back your items.

If my Zalando and Partner items arrived in one parcel, can I return them in one parcel?
Yes, you can return the items together.

What do I do if I do not have a return label?
If you need a new return label, you can download this from your account. If the label isn't available to download, please contact our customer care team who will request the return label from the partner for you.

When will I receive my refund?
You will receive your refund within 14 days of handing over the parcel to the return carrier. Please make sure to keep the return receipt from the carrier until you have received your refund.",Returns & Refunds
How do I return items using a QR code?,Order related queries,"You can find the QR code in the ""Returns"" section of your account.

You will find the option to create a QR code in the return flow in your account. If you complete the return flow without creating a QR code, you will not be able to create one later.

Please show the QR code to the carrier when you drop off your return parcel. The carrier will print the return label and attach it to your return parcel.",Returns & Refunds
Where is my parcel?,Order related queries,"To track the delivery status of your parcel, simply click on the tracking link provided in your shipment confirmation email after your parcel has been dispatched. Alternatively, you can also find this information under 'My Account' on the Zalando website.

What can I do if the tracking link is not yet live?
Please be patient, the tracking link will not be live until your package has been received by the carrier.

What if the tracking link does not update?
Please note the tracking link does not update daily. However, if the tracking link has not updated within 5-6 business days please contact our customer service.

I have received a notification that the parcel has been delivered, but I do not have it. What should I do?
Please check if the parcel was delivered to a neighbour. If this is not the case and the parcel has not been delivered to you within one week after it has been shipped, please contact our customer service through a contact channel shown below.",Delivery
How are Partner items delivered?,Order related queries,"Zalando Partner items are sent to you directly by our Partners. You can see the estimated delivery date at checkout and in your order confirmation mail.

Once your parcel has been shipped you will receive a shipment confirmation mail incl. a tracking link. Through this link you can find out the exact delivery date as soon as it is scheduled by the carrier.

Please note:
Zalando Partner items can only be shipped via standard delivery

If you order multiple items from Zalando and our Partners, they will be sent in separate parcels.",Delivery
Why is my order split into several parcels?,Order related queries,"In order to ensure that you receive your items fast we might already ship some items before the others are ready to be shipped.

Please note:
Since Partner items are shipped directly from our partners, you will receive these items in a separate package from items directly shipped by us.

We will let you know at checkout if your items will be shipped separately.

For each shipment, you will receive a separate shipment confirmation email with a tracking link.",Delivery
Can I have my parcel delivered to a pick up point?,Order related queries,"Yes, you can. When you complete your order, we offer the convenient option of having your parcel delivered to an Evri parcel shop.

You can find a pick-up point near you at checkout or here:

[Evri parcel shop](https://www.evri.com/find-a-parcelshop)

Please note:
You will receive an sms from the carrier once your parcel was delivered and can be picked up

You can pick up your parcel within 7 days before it is returned to the sender.",Delivery
What should I do if my parcel arrives in damaged packaging?,Order related queries,"We're sorry to hear that, and hope that the items you ordered arrived intact and complete.

If the damage only affects your parcel and you would like to return something from that order, you can use any packing material for the return. Please make sure to use the return documents we provided in the parcel - with our return label, the return is always free of charge.

Please note that we cannot provide substitutes for damaged parcels.",Delivery
Why did I receive different orders in one parcel?,Order related queries,"In order to deliver your items in the quickest and most eco-friendly way we sometimes bundle different orders in one parcel. To see if your orders are bundled please check your delivery confirmation mail or log into your account on the Zalando website.

How do I pay for separate orders that were bundled and delivered together?
Different orders need to be paid separately, even if they were delivered together.

To ensure that your payments are booked correctly, please add the order number of each order in the payment message field.

How do I return items from different orders?
If you want to return items from bundled orders you can pack all items in one return parcel.",Delivery
Why was my parcel returned to the sender?,Order related queries,"If your parcel could not be delivered, don't worry! We'll consider it returned, and refund you if you've already paid for it.

Please note:
- We do not automatically reship returned orders. If you still wish to receive the items, you will need to place a new order.

- Your refund may take up to 14 days from the date your parcel was returned.",Delivery
Which countries does Zalando deliver to?,Order related queries,"Orders placed on Zalando.uk can be delivered within the UK.

Zalando is also available in the following countries:

Austria, Belgium, Croatia, Czech Republic, Denmark, Estonia, Finland, France, Hungary, Ireland, Italy, Latvia, Lithuania, Luxembourg, Netherlands, Norway, Poland, Romania, Slovakia, Slovenia, Spain, Sweden, Switzerland, Germany",Delivery
What delivery options are available?,Order related queries,"You can choose the following delivery options:

| Delivery Option       | Delivery Time                                                        | Delivery Fee                | Delivery Destinations                   | Please Note                                                                                      |
|-----------------------|----------------------------------------------------------------------|-----------------------------|-----------------------------------------|--------------------------------------------------------------------------------------------------|
| Standard delivery     | Please see our delivery promise in checkout or in the order confirmation email | Free for orders above £35.00 | Evri home delivery, Yodel home delivery, Evri pick-up point | If your order value was below £35.00 and you paid a delivery fee, we will refund the delivery fee if the complete order is returned. |
|                       |                                                                      | £3.99 for orders below £35.00 |                                         |                                                                                                  |
| Long distance delivery| 1-2 days longer than standard delivery                               | £3.99                       | Evri home delivery, Yodel home delivery, Evri pick-up point | If your order contains both standard delivery items and long distance items, you will receive the items in different parcels.         |",Delivery
What does standard delivery include?,Order related queries,"Standard delivery includes the following:

| Delivery Time                                                        | Delivery Fee                | Delivery Destinations       | Please Note                                                                                      |
|----------------------------------------------------------------------|-----------------------------|-----------------------------|--------------------------------------------------------------------------------------------------|
| Please see our delivery promise in checkout or in the order confirmation email | Free for orders above £35.00 | Evri home delivery, Yodel home delivery | If your order value was below £35.00 and you paid a delivery fee, we will refund the delivery fee if the complete order is returned. |
|                                                                      | £3.99 for orders below £35.00 |                             |                                                                                                  |",Delivery
What does long distance delivery include?,Order related queries,"Long distance delivery includes the following:
| Delivery Time                        | Delivery Fee | Delivery Destinations       | Please Note                                                                                      |
|--------------------------------------|--------------|-----------------------------|--------------------------------------------------------------------------------------------------|
| 1-2 days longer than standard delivery | £3.99        | Evri home delivery, Yodel home delivery, Evri pick-up point | If your order contains both standard delivery items and long distance items, you will receive the items in different parcels. |",Delivery
What is a Zalando Partner item?,Non order related queries,"To make our range even wider and more exciting, we are working with selected Partner brands.

How do I know if I'm purchasing a Partner item?
If an item is a partner product, on the product page of the item you'll see ""Sold by (name of the partner)"".

If you look at an order in your customer account, you will also be able to see whether you have ordered partner items. If an order is coming from a partner, it will be identified as ‘Sold by (partner name)'.",Zalando Partner
How will I receive my Zalando Partner item,Non order related queries,"This depends on who ships your items. You will see this information on the product page.

Sold by Partner, shipped by Zalando

Your Partner item(s) will be shipped by Zalando. If you have an order that comprises both Zalando and Partner items, your items may be shipped in one parcel.

Sold and shipped by Partner

Your Partner item(s) will be shipped directly from a Partner. If you have an order that comprises both Zalando and Partner items, your items will be shipped in separate parcels.

Please note:
For items sold and shipped by our Partners we can only offer standard delivery",Zalando Partner
How do I return a Zalando Partner item?,Non order related queries,"You can return your Partner items within 100 days, free of charge.

[Return items](https://accounts.zalando.com/authenticate?redirect_uri=https%3A%2F%2Fwww.zalando.co.uk%2Fsso%2Fcallback&client_id=fashion-store-web&response_type=code&scope=openid&request_id=qsdMuR1wKWdR3Xo-%3A450d08e0-701a-494a-b368-b208c59e077e%3AqsdMuR1wKWdR3Xo-&nonce=801b5450-794c-4d10-8b69-4f1b105057cf&state=eyJvcmlnaW5hbF9yZXF1ZXN0X3VyaSI6Ii9yZXR1cm5zL2FydGljbGVzLyIsInRzIjoiMjAyNC0wOS0xNFQxMDoxMzowM1oifQ%3D%3D&premise=unified_sso_ui&ui_locales=en-GB&zalando_client_id=450d08e0-701a-494a-b368-b208c59e077e&cid=GA1.1.1737651450.1726050971&sales_channel=83c4e87f-6819-41bb-af61-46cddb8453f5&client_country=GB&client_category=fs&view=verify-email)
How do I return an item that was sent to me directly by a Zalando Partner?
Please send the item back to the Partner. Just use the enclosed return label to send back your items.

If my Zalando and Partner items arrived in one parcel, can I return them in one parcel?
Yes, you can return the items together.

What do I do if I do not have a return label?
If you need a new return label, you can download this from your account. If the label isn't available to download, please contact our customer care team who will request the return label from the partner for you.

When will I receive my refund?
You will receive your refund within 14 days of handing over the parcel to the return carrier. Please make sure to keep the return receipt from the carrier until you have received your refund.",Zalando Partner
Important tips for redeeming a gift card,Non order related queries,"Use a Gift Card for your order at Zalando
A Gift Card allows you to pay while ordering at Zalando or add it to your gift card total under ""My gift card total"". You can then use it at any time when you next order.

Use as many Zalando gift cards together as you like with a total maximum amount of £170.00. The maximum value of Gift Cards that can be used per calendar month is limited to €5,000 The maximum value of Gift Cards that can be connected to your customer account per calendar month is limited to €5,000.

Gift cards purchased via other country sites are not valid on Zalando.co.uk.

Gift cards have no minimum order size and are valid until their total is used, within five years of the initial purchase of the gift card.

Enter the gift card code
Redeem your gift card during checkout or add the amount to your gift card total ready to use whenever you place an order.

You can only enter the gift card once and it is then added to your gift card total and can be used.

Did you forget to enter the gift card code? No problem! For a limited time, you will be able to cancel your order and easily order again using the code.

Enter the code in the field provided. Doesn’t work? Please take care to avoid including any extra spaces.

Refund of Gift Cards
Unfortunately, it is not possible to exchange a gift card for cash.

If you return items to us, where the gift card total was applied to, we will refund the amount back to your gift card total, which you may use right away on your next order",Gift card and Voucher
How do I redeem a gift card?,Non order related queries,"There are two ways to redeem your Zalando gift card:

- As gift card total:

[REDEEM YOUR GIFT VOUCHER](https://accounts.zalando.com/authenticate?redirect_uri=https%3A%2F%2Fwww.zalando.co.uk%2Fsso%2Fcallback&client_id=fashion-store-web&response_type=code&scope=openid&request_id=E6vQee2WiJ7z+Mip%3A450d08e0-701a-494a-b368-b208c59e077e%3AE6vQee2WiJ7z+Mip&nonce=bc29ffbf-f7a4-446f-bbbd-857d55601273&state=eyJvcmlnaW5hbF9yZXF1ZXN0X3VyaSI6Ii9teWFjY291bnQvZ2lmdHZvdWNoZXJzLz8iLCJ0cyI6IjIwMjQtMDktMTRUMTA6MTY6MTBaIn0%3D&premise=unified_sso_ui&ui_locales=en-GB&zalando_client_id=450d08e0-701a-494a-b368-b208c59e077e&cid=GA1.1.1737651450.1726050971&sales_channel=83c4e87f-6819-41bb-af61-46cddb8453f5&client_country=GB&client_category=fs&view=verify-email)

Enter your gift card's code in the Menu item 'My gift card total' and click on 'Redeem gift card’. The amount will be added to your gift card total and you can redeem it when placing your next order.

Your gift card total can now be used for fashion items (excluding e.g. beauty products and electronics) which are offered by Zalando SE or other sellers on the website within the next five years after the initial purchase.

At checkout: You can also enter your gift card code in the “Add a voucher/gift card” field that appears at checkout. Don’t forget to confirm by clicking on the button 'Redeem'. The gift card amount is then applied for all eligible items to the total amount in the shopping basket.

Would you rather not redeem the gift card? No worries. Click on the 'X' at the bottom right of the price breakdown to undo the operation. However, please note that this is only possible as long as you have not clicked on 'Buy now'.",Gift card and Voucher
What happens to my gift card following a return?,Non order related queries,"Paid for your order in full using a gift card?
In this case, it will be added back to your gift card total on your Zalando account. You can use it for your next order against eligible items. You can check your current available amount at any time under ""Gift cards"".

Have you paid for your order by combining a gift card with a different payment method?
The gift card is valid for fashion items. When you return one or more of these items, you will be refunded to the other payment method selected at checkout when you placed the order. For example, if you used a credit card as well as a gift card, you will be refunded to your credit card and the gift card will be applied to the kept fashion items.

If the gift card amount is larger than the amount used from the other payment method, you will be refunded to your gift card total.",Gift card and Voucher
Gift cards and vouchers general informations,Non order related queries,"* Voucher Codes﻿
Please note that each voucher code may only be used once. The following applies to vouchers from campaigns in our newsletters, magazines, etc:
	* Only one voucher code can be redeemed per order. Vouchers can, however, be used in combination with Gift Cards.
	* Please check the expiry date of your voucher code
	* Certain voucher codes cannot be used to purchase discounted items
	* Voucher codes may only be valid for particular products and categories
	* Voucher codes may have a minimum order value
	* If you send goods back, we reserve the right to not renew the validity of your voucher code
* Gift Cards
	* Gift cards are valid for a limited period of five years from the purchase date.
	* It is possible to use more than one gift card per order (these can also be used in combination with a voucher code) until you reach a maximum amount of £170. The maximum value of Gift Cards that can be used per calendar month is limited to €5,000. The maximum value of Gift Cards that can be connected to your customer account per calendar month is limited to €5,000.
	* After placing an order, any value left on your gift card will stay on your gift card total.
	* Your gift card total can be found in ‘My Account’ under ‘Gift card total’
	* If you return goods that have been purchased with a gift card the amount will be refunded back to your gift card total and you will be able to use it on future orders.
	* Gift card total cannot be exchanged for cash
	* There is no minimum order value for orders placed using a gift card",Gift card and Voucher
How do I buy a gift card?,Non order related queries,"You can buy gift cards for various occasions in the Zalando Gift Card section on Zalando.co.uk.

You have the following options of delivery when purchasing:

1. As a printable PDF file

2. By email

3. By post (delivery takes one or two working days)",Gift card and Voucher
What can I use my gift card for?,Non order related queries,"We have updated our gift card [terms and conditions](https://www.zalando.co.uk/terms-giftcards/).

Your gift card can be used for fashion wearables on the Zalando platform.

When we say ""fashion wearables"" we mean items and textile accessories that bring out the best in you, from your everyday basics to our Designer and Luxury brands, including but not limited to*:

	* Shoes (Footwear)
	* Trousers
	* Sports garments
	* Skirts
	* Dresses
	* Shirts / Tops
	* Jackets
	* Bags / Handbags
	* Hats/Caps
	* Scarves
	* Glasses
	* Gloves
	* Belts
	* Lingerie

There are a few categories that don't fall under “fashion wearables”, such as:

	* Jewellery and watches
	* Home, lifestyle and electronics
	* Sports equipment
	* Travel bags and wallets
	* Beauty and makeup

* Exceptions reserved.

For these categories you can always use your other favourite payment method to make your purchase.

Your gift card is valid for several hundred thousand items you can choose from. You also have the flexibility to combine your gift card to pay for eligible items and use your favourite payment method for those that fall outside its coverage in the same order.

Think fashion, not function when using your gift card and you’ll be amazed by what you can buy!",Gift card and Voucher
