instruction,context,response,category
Why is my web provider recommending that I change my password?,Non order related queries,"According to our Privacy Notice , your credentials are secured on our website and Zalando will never use them for any purpose.

If Google recommends changing your password on our website, this is not related to a Zalando specific data breach. This is a Google Chrome feature that verifies if the password for all websites you log in to has been part of any known breach.

When you logged-in to our website, Google Chrome possibly noticed the password or username you used are potentially exposed in one of the known data breaches.

Please visit Google security blog for more information.

What does it mean that my email/password is on a list of public data breaches?
If we notified you that your registration or login data is on a list of public data breaches, this means that the email/password you entered has been leaked on websites outside of Zalando. In this case, we strongly advise that you change your password on all websites where you use the same set of username and password as a precautionary measure.",My Account
What are Zalando's accessibility functionalities?,Non order related queries,"One of our promises is to offer the best customer experience to the widest audience possible. We are working actively on providing an accessible and usable website. Therefore, we introduced new functionalities to help everyone to enjoy the best of what we can offer.

Our accessibility promise
The UN Convention on the Rights of Persons with Disabilities recognised access to information and communications technologies, including the Web, as a basic human right.

Therefore, we provide on the shop, the product pages and the customer account new functionalities such as alternative text and screen readers to be accessible for everyone, no matter what device or assistive technology our customers are using.

The screen reader and the alternative text functions are forms of assistive technology (AT) useful for people who are visually impaired, illiterate, or have a learning disability. Thanks to a voice over function, people can have a vocal description of a page, a specific text, the product images and the links they click on towards the Zalando website.

We have successfully made these parts of the website accessible and we are currently working on offering the same level of usability to other parts of the website very soon.

As of now, our website contains accessible functionalities. If you are using the Zalando app and want to enable the accessible mode, please visit our website.

How can I enable screen readers on Zalando?
You can test the screen readers on the Zalando website by installing one of the following app/ plugin to your browser:

* VoiceOver macOS & iOS

* ChromeVox Chrome plugin

* NVDA Windows

* JAWS only paid, not available for free.",My Account
How do I request my data?,Non order related queries,"Requesting your data
If you would like to see your order history, the saved addresses for your orders, or view or adjust your liked items, please go to your account page. You will also be able to check and adjust the information that is saved for you favourite brands or your preferred sizes, and manage newsletter or mailing subscriptions in this section of the website.

If you would like to request a downloadable file of your account data that includes contact information, order history, liked items and an overview of when and how you may have contacted us, you can do so in your account . Once the file is ready, we will send it to you via email. This can take up to one month but usually you should receive your data earlier.

What information is in my data report?
Your data report will contain an overview of your account and log-in information, order overview, personalisation preferences, and liked items. It also includes information about data retention periods and third-party sharing.

What if my data file failed to download?
If you requested your file and it fails to download, it could be because the link has expired. The download link is only valid for 30 days after it is received. After this, you will need to submit a new request.

If your download link is valid but failed to download, it could be due to a network issue, a problem with your browser, or an issue on the server side. In such cases, check your internet connection or try opening it using a different device or browser. If that is unsuccessful, please submit a new request.

What format will my data come in?
The email we send you will contain two different reading formats: ZIP and HTML. The HTML file provides a user-friendly visualisation of your data that is viewable in any web browser. The ZIP file contains CSV files with your data in a machine-readable format, suitable for analysis or processing in applications like Excel.

Why is an email code needed to download my report?
When you download your report, we send a unique code to your email as an additional security step. You will need to enter this code to complete your download. This is to ensure it's you accessing your information, and to keep your personal details safe and secure.",My Account
How can I better protect my account?,Non order related queries,"The easiest way to protect your account is by choosing a strong password. Here are a few recommendations:

* Make it long. Using long passwords is critical to password strength. An 8-character password will take anywhere from a few minutes to a few weeks to crack while a 16-character password will take a minimum of 34.000 years to crack.

* Use lower and upper case letters, numbers, and special characters. The password that strong would take 2 minutes to crack while it would take 3 weeks for attackers to crack the password H0wStr0!g

* Do not reuse passwords. Reusing the same password for multiple accounts is dangerous as it makes you vulnerable to credential stuffing attacks, which take leaked credentials from one site/service and use them on other sites/services. It's as if you had multiple houses and used the same lock and key for all of them.

* Make your passwords random . Do not include words related to your personal information in your passwords as it would give an advantage to attackers.

* Use a password manager. A password manager is an application that helps you create, store, and manage unique passwords. It is the easiest and most secure way to accomplish this.

If you have any questions or concerns about data protection please contact our Privacy team: privacy@zalando.co.uk

You can also contact our Data Protection Officer directly in the following postal address indicating that it is “to the attention of Data Protection Officer”:

Data protection Zalando SE

Valeska-Gert-Straße 5

10243 Berlin

Germany

Telefax: +49 (0)30 2759 46 93",My Account
How does the Fashion Assistant work,Non order related queries,"What can the Fashion Assistant help me with?
You can ask the assistant anything related to fashion and beauty. It can help you find the right products on Zalando that you'll love, as well as provide advice on fashion and beauty questions. Just let it know what you're looking for or what you need help with!

How does the Fashion Assistant work?
You can open the Fashion Assistant from the homepage, the catalogue, or the product detail page by clicking the Fashion Assistant icon. The assistant is integrated with a publicly available interface from the company OpenAI (the creator of ChatGPT). When you ask the Zalando Fashion Assistant a question, it forwards this question to the interface from OpenAI. The machine learning technology from OpenAI will analyse your questions and reformulate your input in a way that Zalando can provide fitting product recommendations based on your questions. Your chat history will not be saved in your customer profile, but you can access your last chat in the assistant for 20 minutes after the chat ended. After this you can always start a new chat by clicking on the Fashion Assistant icon again.

Can I also talk to a human to get advice?
The fashion Assistant is not supported by a human advisor. It is meant to be a machine learning-based advisor which uses data and algorithms to provide guidance in fashion. If you want personal style advice you can use the Zalando Plus Style advice or in case you have order specific questions, please reach out to our customer service.

If the Fashion Assistant is not human, then how does the Assistant make an assessment?
The assistant relies on your questions as well as OpenAI’s special abilities to find appropriate answers, to produce suitable recommendations for your needs.

How do you ensure that answers are fair and correct?
The fashion assistant responds to the concrete content of your request and makes the assessment on that basis and Zalando’s openly and neutrally worded instructions to OpenAI. But please keep in mind that machine learning based answers can always be subjective, even wrong sometimes and may include some biases.If you would like to learn more about the embedded OpenAI model, please have a look at the policies of OpenAI which are available on https://openai.com/policies.

How can I get back to my last chat?
You can get back to your previous chat by clicking on the assistant icon on the same device. However, it will only be available for 20 minutes after you wrote your last chat message.

Will my chat data be shared with someone outside of Zalando?
The Fashion Assistant utilises the information you provide within the chat and shares it with OpenAI in order to generate the most suitable answers to your questions. However, OpenAI will not have access to your Zalando customer account data and will not use your chat to train their model.

Who can I contact in case I experience problems?
If you experience any problems, please contact our customer support team.",My Account
Inactive accounts,Non order related queries,"Why am I receiving this email?

This email is sent to customers who have not placed orders over the last 5 years and haven't visited any of Zalando's websites in the last 13 months. It is one of the measures we take to treat your data responsibly and comply with GDPR.

I am also a Zalando Lounge customer. Can I delete only one of my accounts?

All of Zalando's shops use the same account, so by deleting your account, you will not be able to access any of them.

Can I delete only my web or app account?

No. The account used in the web and in the application is the same.

Can I register again after deleting my account?

Yes, you can create a new account, using the same email address.

I don’t want my account deleted, what should I do?

You can simply click on the link in the email you received. Logging into your account will also signal that we should keep your data.

I’ve changed my mind, can I get my account recovered?

If the date indicated in the email has not yet come, yes, you can let us know via the link in the message and we will keep your account. Unfortunately, after the deletion is triggered, we have no way to recover the account and you will need to create a new one. All associated data is also deleted automatically.",My Account
About Zalando,About Zalando,"As a leading European online platform for fashion and lifestyle we deliver to customers in 25 countries. In our fashion store, they can find a wide assortment from more than 6,000 brands.",About us
Who we are ?,About Zalando,"We have grown from a pioneer in e-commerce to building the leading pan-European ecosystem for fashion and lifestyle e-commerce.
Founded in 2008 in Berlin, Zalando is building the leading pan-European ecosystem for fashion and lifestyle e-commerce.",About us
What we do ?,About Zalando,"As an online platform for fashion and lifestyle, we connect customers, brands and partners.",About us
zalando Services and contact ?,About Zalando,"Do you have any questions about your order or about our website? We have compiled answers to common questions in our customer service section. If your question is not answered there, you can also contact us by chat, by phone or via our contact form. Please note: This FAQ is valid only for zalando.de. For other countries, please visit the respective local Zalando website.

Sponsoring requests:
Zalando is aware of social responsibility of companies and defines this as an important part of corporate activity. Surely many projects deserve to be supported. With this in mind, we focus on selected organizations and projects to encourage and support them. For this reason, we ask for your understanding that we can not perceive sponsorship and cooperation requests.

Notifications of major holdings (Sec. 33, 38, 39 WpHG):
Please send notifications via the reporting and publication platform of BaFin (MVP). You will find more detailed information on the transmission via MVP on the BaFin homepage.
We kindly ask you to send the readable version (pdf), the XML file as well as any attachments for the publication of the voting rights notification in electronic form to adhoc@zalando.de. Important note: This e-mail address is used exclusively for special purposes in connection with voting rights notifications and proprietary transactions by executives. It cannot be used for inquiries regarding orders, products or other customer inquiries.

Notifications of directors' dealings (Art.19 MAR):
Please send reports via fax to: +49 (0)30 2000889349. To accelerate the process, we kindly ask you to send an electronic copy to adhoc@zalando.de. Important note: This e-mail address is used exclusively for special purposes in connection with voting rights notifications and proprietary transactions by executives. It cannot be used for inquiries regarding orders, products or other customer inquiries.",About us
What is Zalando ?,About Zalando,"Zalando is a European online fashion and lifestyle platform founded in 2008 in Berlin, Germany. It offers a wide range of products including clothing, footwear, accessories, and beauty items for men, women, and children. Zalando operates in multiple countries across Europe, serving millions of customers.

The platform partners with a variety of global fashion brands, from high-end luxury labels to more affordable options, and also provides its own private label products. Zalando is known for its extensive catalog, user-friendly shopping experience, and services like free delivery and returns. It also offers personalized recommendations, making it a popular destination for fashion-conscious shoppers.",About us
